{
  "contractVersion": "0.1.0",
  "generatedAt": "2026-05-31T00:00:00.000Z",
  "mode": "synthetic_architecture_prototype",
  "records": [
    {
      "contractName": "activity-progress",
      "schemaPath": "schemas/activity-progress.schema.json",
      "classification": "restricted",
      "piiRisk": "medium",
      "realDataAllowed": false,
      "recordTypes": ["session_state", "learner_work"],
      "requiresConsentScopes": ["progress_tracking"],
      "retentionPolicyRequired": true,
      "exportRequired": false,
      "deletionRequired": true,
      "productionRequirements": ["privacy and retention review before real learner use", "active consent or authority before real progress tracking", "review shared-device behavior and parent controls"],
      "notes": "Synthetic demo resume state only. Browser-local answer IDs and memory layout; no identity, timestamps, analytics or network sync. Clear saved progress removes this namespace only."
    },
    {
      "contractName": "activity-set",
      "schemaPath": "schemas/activity-set.schema.json",
      "classification": "synthetic_safe",
      "piiRisk": "none",
      "realDataAllowed": false,
      "recordTypes": ["curriculum"],
      "requiresConsentScopes": [],
      "retentionPolicyRequired": false,
      "exportRequired": false,
      "deletionRequired": false,
      "productionRequirements": ["educator review of content, answers, accessibility and age suitability"],
      "notes": "Authored synthetic activities only. No learner responses or profiles in this contract."
    },
    {
      "contractName": "account-ledger-entry",
      "schemaPath": "schemas/account-ledger-entry.schema.json",
      "classification": "prohibited_until_review",
      "piiRisk": "high",
      "realDataAllowed": false,
      "recordTypes": [
        "billing",
        "voucher",
        "audit"
      ],
      "requiresConsentScopes": [
        "voucher_billing",
        "data_export"
      ],
      "retentionPolicyRequired": true,
      "exportRequired": true,
      "deletionRequired": true,
      "productionRequirements": [
        "data classification reviewed against regulatory assumptions",
        "least-privilege access controls enforced",
        "audit events emitted for create/read/update/delete/export paths",
        "active consent or authority check for required scopes",
        "voucher/payment compliance review before real funds"
      ],
      "notes": "Reference/synthetic use only unless production requirements are satisfied."
    },
    {
      "contractName": "account",
      "schemaPath": "schemas/account.schema.json",
      "classification": "prohibited_until_review",
      "piiRisk": "high",
      "realDataAllowed": false,
      "recordTypes": [
        "identity"
      ],
      "requiresConsentScopes": [
        "guardian_notifications",
        "data_export"
      ],
      "retentionPolicyRequired": true,
      "exportRequired": true,
      "deletionRequired": true,
      "productionRequirements": [
        "data classification reviewed against regulatory assumptions",
        "least-privilege access controls enforced",
        "audit events emitted for create/read/update/delete/export paths",
        "active consent or authority check for required scopes"
      ],
      "notes": "Reference/synthetic use only unless production requirements are satisfied."
    },
    {
      "contractName": "api-http-exchange",
      "schemaPath": "schemas/api-http-exchange.schema.json",
      "classification": "restricted",
      "piiRisk": "medium",
      "realDataAllowed": false,
      "recordTypes": [
        "api_exchange"
      ],
      "requiresConsentScopes": [],
      "retentionPolicyRequired": true,
      "exportRequired": false,
      "deletionRequired": true,
      "productionRequirements": [
        "data classification reviewed against regulatory assumptions",
        "least-privilege access controls enforced",
        "audit events emitted for create/read/update/delete/export paths"
      ],
      "notes": "Reference/synthetic use only unless production requirements are satisfied."
    },
    {
      "contractName": "audit-event",
      "schemaPath": "schemas/audit-event.schema.json",
      "classification": "prohibited_until_review",
      "piiRisk": "high",
      "realDataAllowed": false,
      "recordTypes": [
        "audit"
      ],
      "requiresConsentScopes": [
        "data_export"
      ],
      "retentionPolicyRequired": true,
      "exportRequired": true,
      "deletionRequired": true,
      "productionRequirements": [
        "data classification reviewed against regulatory assumptions",
        "least-privilege access controls enforced",
        "audit events emitted for create/read/update/delete/export paths",
        "active consent or authority check for required scopes"
      ],
      "notes": "Reference/synthetic use only unless production requirements are satisfied."
    },
    {
      "contractName": "checkout-session",
      "schemaPath": "schemas/checkout-session.schema.json",
      "classification": "prohibited_until_review",
      "piiRisk": "high",
      "realDataAllowed": false,
      "recordTypes": [
        "billing",
        "voucher"
      ],
      "requiresConsentScopes": [
        "voucher_billing",
        "data_export"
      ],
      "retentionPolicyRequired": true,
      "exportRequired": true,
      "deletionRequired": true,
      "productionRequirements": [
        "data classification reviewed against regulatory assumptions",
        "least-privilege access controls enforced",
        "audit events emitted for create/read/update/delete/export paths",
        "active consent or authority check for required scopes",
        "voucher/payment compliance review before real funds"
      ],
      "notes": "Reference/synthetic use only unless production requirements are satisfied."
    },
    {
      "contractName": "consent-record",
      "schemaPath": "schemas/consent-record.schema.json",
      "classification": "prohibited_until_review",
      "piiRisk": "high",
      "realDataAllowed": false,
      "recordTypes": [
        "consent"
      ],
      "requiresConsentScopes": [
        "data_export"
      ],
      "retentionPolicyRequired": true,
      "exportRequired": true,
      "deletionRequired": true,
      "productionRequirements": [
        "data classification reviewed against regulatory assumptions",
        "least-privilege access controls enforced",
        "audit events emitted for create/read/update/delete/export paths",
        "active consent or authority check for required scopes"
      ],
      "notes": "Reference/synthetic use only unless production requirements are satisfied."
    },
    {
      "contractName": "data-retention-policy",
      "schemaPath": "schemas/data-retention-policy.schema.json",
      "classification": "synthetic_safe",
      "piiRisk": "low",
      "realDataAllowed": false,
      "recordTypes": [
        "retention"
      ],
      "requiresConsentScopes": [],
      "retentionPolicyRequired": true,
      "exportRequired": false,
      "deletionRequired": true,
      "productionRequirements": [],
      "notes": "Reference/synthetic use only unless production requirements are satisfied."
    },
    {
      "contractName": "data-inventory",
      "schemaPath": "schemas/data-inventory.schema.json",
      "classification": "public_contract",
      "piiRisk": "none",
      "realDataAllowed": true,
      "recordTypes": [
        "contract_metadata",
        "retention"
      ],
      "requiresConsentScopes": [],
      "retentionPolicyRequired": false,
      "exportRequired": false,
      "deletionRequired": false,
      "productionRequirements": [],
      "notes": "Public contract metadata or configurable catalog/policy data; still review before deployment."
    },
    {
      "contractName": "device-profile",
      "schemaPath": "schemas/device-profile.schema.json",
      "classification": "restricted",
      "piiRisk": "medium",
      "realDataAllowed": false,
      "recordTypes": [
        "device"
      ],
      "requiresConsentScopes": [],
      "retentionPolicyRequired": true,
      "exportRequired": false,
      "deletionRequired": true,
      "productionRequirements": [
        "data classification reviewed against regulatory assumptions",
        "least-privilege access controls enforced",
        "audit events emitted for create/read/update/delete/export paths"
      ],
      "notes": "Reference/synthetic use only unless production requirements are satisfied."
    },
    {
      "contractName": "evaluation-result",
      "schemaPath": "schemas/evaluation-result.schema.json",
      "classification": "restricted",
      "piiRisk": "medium",
      "realDataAllowed": false,
      "recordTypes": [
        "learner_work",
        "session_state"
      ],
      "requiresConsentScopes": [],
      "retentionPolicyRequired": true,
      "exportRequired": false,
      "deletionRequired": true,
      "productionRequirements": [
        "data classification reviewed against regulatory assumptions",
        "least-privilege access controls enforced",
        "audit events emitted for create/read/update/delete/export paths"
      ],
      "notes": "Reference/synthetic use only unless production requirements are satisfied."
    },
    {
      "contractName": "funding-source",
      "schemaPath": "schemas/funding-source.schema.json",
      "classification": "synthetic_safe",
      "piiRisk": "low",
      "realDataAllowed": false,
      "recordTypes": [
        "voucher",
        "billing"
      ],
      "requiresConsentScopes": [],
      "retentionPolicyRequired": true,
      "exportRequired": false,
      "deletionRequired": false,
      "productionRequirements": [
        "voucher/payment compliance review before real funds"
      ],
      "notes": "Reference/synthetic use only unless production requirements are satisfied."
    },
    {
      "contractName": "interaction-event",